title,auther
两只兴奋的大母猴请求支援,留恋那抹...
走过最远的路就是爷爷的套路~一比一打平,十年唯爱...
哈哈哈哈哈哈笑出了声！！！【搞笑】,宣化羊肉...
一个同事讲的:我们初中的时候，那会流行看鬼片。一天白天我们一帮人，在一小童鞋家里看鬼片。为了制造气氛，我们把客厅的窗帘拉上。屋里稍微黑了点。正当我们一帮人看着看,九头纪
新生开学，如何优雅的拿着行李穿越两个城市去上学?,_不须归...
今天去相亲，妈妈和李阿姨相谈甚欢，我和她相视无言，各玩手机。一会儿，我竟睡去了。妈推我说:别的孩子抱着手机精神抖擞，他捧手机就打瞌睡。我接过口对女孩说:是的呢，,冬日阳光...
我以为变乖了呢,-大河马...
冷嗖嗖表情包最近降温很快大家注意别感,没有表情...
你永远无法叫醒一个装睡的猪,糗百精华...
像极了你做数学题的步骤,那天遇到...
最近看老妈用的锅子不行，淘宝看了下火速买了个，第二天老妈就收到锅了，来了句，咋没有锅盖呢？失误了，一直以为锅盖锅子是成套卖的，不成想着都能分开卖。。。,平平仄仄...
一组懒羊羊表情包,汪紫薇
当你把智力全点在游戏上时,-奶茶蔻...
收废品的都实现线上下单了，我们还在原地踏步,A_哎呦
？,玲玲玲玲...
终于转生到了游戏世界啦！！,陈恒全
真实,腼腆的小...
title,auther
闺蜜说想拍可爱的私房照,白玉无尘
霉霉:亲吻男粉丝、真羡慕那个男粉丝、可以一辈子不用洗脸了、,不样沏又
楼梯都被占满了！！,少爷杨姐...
晚上和老婆一起看电视，电视里男主一个公主抱把女主从客厅抱到卧室，女主脸上洋溢着幸福的笑容。我斜眼偷偷瞄了一眼老婆，看她眼神里透露着一股渴望的味道。想想老婆嫁给我,油腻的胡...
当你用软件和胡迪换脸后,熊Viv...
除了结婚，我想这是我最风光的日子！,一枕清霜
收废品的都实现线上下单了，我们还在原地踏步,A_哎呦
圈子不同，不要硬融,逗b聚乐...
土豆的表情包又来了喔猫猫主人,要图吗兄...
追你那么远就是为了看你的劈叉！！！,爱你魅力...
有内鬼，终止交易！,东临～天...
媒婆猫！！,Step...
看什么看没见过猛男收银u/luk,zhan...
A,树猫儿
优秀的男孩已经开始内部消化了,板牙鲨鱼
猫咪摄影师分享生活在海边的喵星人日常，恬淡如水的日子里，喵星人画风，也是可爱治愈与紧张激烈并存啊！,杨永乐8...
